{"head":{"phase":"CANDIDATE_HANDOFF","receipt_id":"sha256:dc6dd3f22864eec0ce6275d6ccb758b94f0a7455fd429480044abc435f841b1f","receipt_sha256":"sha256:0e74d07c8abb8d6a6ce735b51f6586a05dcb4b98ac520b284dae1e8ece7bf736","sequence":0},"receipt":{"attempt":{"attempt_id":"sha256:7a91bc8a4891c0e99458d70bb9ddb6cff9e96a1318c54a02427bdbdc36d1a1b8","queue_entry_id":"sha256:4444444444444444444444444444444444444444444444444444444444444444"},"committer":{"activated_authority_head_generation":1,"activated_authority_head_record_id":"sha256:a75c8a8b952339cc491097ed8043437660d644c00f56cf800ff54cede261f1d0","activated_authority_head_record_sha256":"sha256:64c19060502a13ca71eeb5b3a827bbc83230836df2d40315b54b5258b4244a78","activation_digest":"sha256:0e446a81711c79b3749f0a28af199df455ba389e1288a8d17b51ba307a948784","activation_provisioned_digest":"sha256:12f26d1b6dbbfbbfdc1f08fd74a266672f5196ccefd2a1d94dbcb03cc461ac95","activation_provisioned_record_id":"sha256:aa508c2187fca56f397ff75adc52b94e02f38122cdd48bd42105106e5e0f8e14","activation_record_id":"sha256:16a36e86f6fed5d465ff332511a0ce1a863b55d364b25a7cdaa25db19abf9648","cloudflare_account_id":"00000000000000000000000000000000","deployment_observation_record_id":"sha256:1bf3408be0c405750272000e039b5c151d07bf9167829861a05be6612d611f25","deployment_observation_record_sha256":"sha256:0b42463b6485a3f729c428a1bd2f094c411ef9c99b7839b7bc94095d352f0c1a","expected_service_authorities_sha256":"sha256:71df993aea227b6931fdf9b89391844bf5cb49bdb79444cfd8eaf31d99a8c951","kind":"release_authority_broker","service_authority_activation_record_id":"sha256:52667fad1bfe057aecf679b29b74073b447aae29b485d7a0b671eefbed672958","service_authority_activation_record_sha256":"sha256:c04e4b086cd41b1b3bd8c9713438beb8f5055bb2f32817cac72bca6fe225c8c3","service_authority_inventory_sha256":"sha256:c1ee819fdb3c3b6e8d40f1ee4bd73e5cde943e6558a23084555223e71f64d54a","service_identity":"cloudflare-worker:00000000000000000000000000000000/dpone-release-authority-broker@00000000-0000-4000-8000-000000000001","source_sha256":"sha256:c3f53f0deede8ce31cb56a6b3658914e9b77edcab0ec3567978c4d5c8f6b4fa4","worker_script":"dpone-release-authority-broker","worker_version_id":"00000000-0000-4000-8000-000000000001"},"payload":{"candidate_artifact_broker_request_id":"request-01HXDPONE","candidate_artifact_created_at":"2026-08-15T00:00:00Z","candidate_artifact_digest":"sha256:1725027b73270b1377b3ca99a0f0ff387a9688c2e752e250653d527e2c0e2da6","candidate_artifact_expanded_bytes":11719,"candidate_artifact_expires_at":"2026-08-16T00:00:00Z","candidate_artifact_file_count":25,"candidate_artifact_id":9300000001,"candidate_artifact_policy_blob_sha":"6666666666666666666666666666666666666666","candidate_artifact_policy_sha256":"sha256:4444444444444444444444444444444444444444444444444444444444444444","candidate_artifact_provider_api_version":"2026-03-10","candidate_artifact_provider_metadata_schema":"dpone.github-actions-artifact-observation.v1","candidate_artifact_provider_observation_sha256":"sha256:1880c9f5c0a3b201ebe22823aa32b100f3d160782df43188ad6d1f22c5a341b6","candidate_artifact_provider_response_sha256":"sha256:8888888888888888888888888888888888888888888888888888888888888888","candidate_artifact_raw_zip_sha256":"sha256:1725027b73270b1377b3ca99a0f0ff387a9688c2e752e250653d527e2c0e2da6","candidate_artifact_raw_zip_size_bytes":15735,"candidate_artifact_source_url_expires_at":"2026-08-15T00:01:00Z","candidate_artifact_source_url_sha256":"sha256:7777777777777777777777777777777777777777777777777777777777777777","candidate_artifact_tag_object_sha":"1111111111111111111111111111111111111111","candidate_id":"sha256:9cc7cfd081e05d80233e41ffc15f8297635d188d4e483c72f92ab00a6a126c3c","candidate_inventory_sha256":"sha256:79cbc50da873b5af695db96a8e2ee1be928eea9e9e59f44658dec08f29cf0d66","candidate_manifest_sha256":"sha256:50da789b7cca52acf6674beb05163a2277592000eccc80272e0449cd29e3fb29","candidate_reader_deployment_observation_record_id":"sha256:8888888888888888888888888888888888888888888888888888888888888888","candidate_reader_deployment_observation_record_sha256":"sha256:9999999999999999999999999999999999999999999999999999999999999999","candidate_reader_service_identity":"cloudflare-worker:account-01/dpone-release-candidate-reader@candidate-reader-version-01","candidate_reader_service_version_id":"candidate-reader-version-01","candidate_run_attempt":1,"candidate_run_id":31900000001,"distribution_inventory":[{"filename":"apache_airflow_providers_dpone-0.74.0-py3-none-any.whl","project":"apache-airflow-providers-dpone","sha256":"sha256:d324ca897f502fe0dd46525e9ce0501f11e4790c0ac192335553f57b336164e4","size_bytes":280,"version":"0.74.0"},{"filename":"apache_airflow_providers_dpone-0.74.0.tar.gz","project":"apache-airflow-providers-dpone","sha256":"sha256:33e1103d26803292f5bf68c366ea9de522a3119d6c98e7241d690af8aa694e67","size_bytes":203,"version":"0.74.0"},{"filename":"dpone-0.74.0-py3-none-any.whl","project":"dpone","sha256":"sha256:fe4fca63ae0323237a3c547a06264debcf1b61d7797b64e41492d92b040136fa","size_bytes":206,"version":"0.74.0"},{"filename":"dpone-0.74.0.tar.gz","project":"dpone","sha256":"sha256:2c95966d2ea6d83b46b0221dd74e6065af2d4ec39dd22ca8a67e798ef3a2814b","size_bytes":172,"version":"0.74.0"},{"filename":"dpone_airflow_pack-0.74.0-py3-none-any.whl","project":"dpone-airflow-pack","sha256":"sha256:3bea0fd3e34ff60c97f4c8228e0274956aee8aab3cf65afaa723f46b22a29b1c","size_bytes":245,"version":"0.74.0"},{"filename":"dpone_airflow_pack-0.74.0.tar.gz","project":"dpone-airflow-pack","sha256":"sha256:1a6cf5c91710808612ab7c13344644d1faec8f7419eefcd98e526ea5a4867986","size_bytes":191,"version":"0.74.0"},{"filename":"dpone_native_accel-0.74.0-py3-none-any.whl","project":"dpone-native-accel","sha256":"sha256:6b63f795f3ad890bb7f5bc0216325acd3186586d9ab88797c9ea9f72b831e486","size_bytes":245,"version":"0.74.0"},{"filename":"dpone_native_accel-0.74.0.tar.gz","project":"dpone-native-accel","sha256":"sha256:e80bfc9088cf73477571c9050957c004e7fc65d8b7fee8338b52978087198f00","size_bytes":189,"version":"0.74.0"}],"distribution_inventory_sha256":"sha256:cc023e4f269ebc3ea87e4cdba187231a97238183a78ae305204fa64c06006767","file_count":25,"kind":"CANDIDATE_HANDOFF","state":"CANDIDATE_HANDOFF","total_bytes":11719},"payload_sha256":"sha256:5ff164e64723edefcd3105e4cb9681d4439ae36e309b906d216c3d8293fc94a8","producer":{"actor_id":1001,"audience":"dpone-release-controller-ledger-write","check_run_id":2001,"environment":"release-attest","job_name":"candidate-import","kind":"github_actions_job","oidc_claims_sha256":"sha256:7a6c32ffa6bab4c5e63c9309f7649a805168b0ebf893d253167390bc14720b12","oidc_jti_sha256":"sha256:7f761f90a7ea3ffcddd4ae971f58eb2ed33f9fa101e668c74dfda6de3ba05af1","provider_api_version":"2026-03-10","provider_job_observation_sha256":"sha256:47fb6b7956d60624969de8736624b160da7bac1ecf07acdc7c05a5613e5e7049","repository_id":1305993853,"request_id":"request-01HXDPONE","run_attempt":2,"run_id":123456789,"workflow_id":316322127,"workflow_path":".github/workflows/release-controller.yml","workflow_sha":"cccccccccccccccccccccccccccccccccccccccc"},"receipt_id":"sha256:dc6dd3f22864eec0ce6275d6ccb758b94f0a7455fd429480044abc435f841b1f","receipt_type":"CANDIDATE_HANDOFF","schema":"dpone.release-receipt-envelope.v2","schema_version":2,"scope":{"candidate_id":"sha256:9cc7cfd081e05d80233e41ffc15f8297635d188d4e483c72f92ab00a6a126c3c","kind":"candidate"},"stream":{"previous":"GENESIS","release_authority_id":"sha256:188154d1fc612e1a3331379af64e1ac6511d460cf0758f33a697d9e06e96f118","release_identity_id":"sha256:3d52af3a2bc6eb185a48465c8680d988a57f7fecf668313673ded1aaed3a59ab","sequence":0},"timestamps":{"committed_at":"2026-08-15T00:00:01Z","observed_at":"2026-08-15T00:00:00Z"}},"schema":"dpone.release-controller-candidate-admit-response.v1","schema_version":1}